<?xml version="1.0" encoding="UTF-8"?>
<izvestaj_o_imunizaciji xmlns="https://www.vakcinacija.rs/izvestaj_o_imunizaciji"
    xmlns:xsi="http://www.w3.org/2001/XMLSchema-instance"
    xsi:schemaLocation="https://www.vakcinacija.rs/izvestaj_o_imunizaciji izvestaj_o_imunizaciji.xsd">
    <periodOd>2021-10-10</periodOd>
    <periodDo>2021-10-10</periodDo>
    <datum_izdavanja>2021-10-10</datum_izdavanja>
    <podneto_dokumenata_o_interesovanju>1</podneto_dokumenata_o_interesovanju>
    <primljeno_zahteva_za_sertifikat>1</primljeno_zahteva_za_sertifikat>
    <izdato_zahteva_za_sertifikat>1</izdato_zahteva_za_sertifikat>
    <date_doze_vakcina>
        <data_doza>
            <redni_broj>1</redni_broj>
            <broj_datih_doza>1</broj_datih_doza>
        </data_doza>
    </date_doze_vakcina>
    <raspodela_po_proizvodjacima>
        <stavka>
            <proizvodjac>Pfizer</proizvodjac>
            <broj_doza>2</broj_doza>
        </stavka>
    </raspodela_po_proizvodjacima>
</izvestaj_o_imunizaciji>